Company Name,Website,City / Location,Segment,What They Make,Revenue Band (Estimate),Decision-Maker,E1: Producer,E2: Accessible,Criterion C3 Score,Criterion C3 Evidence,Criterion C4 Score,Criterion C4 Evidence,Criterion C5 Score,Criterion C5 Evidence,Criterion C6 Score,Criterion C6 Evidence,Criterion C7 Score,Criterion C7 Evidence,Criterion C8 Score,Criterion C8 Evidence,Overall Federer Score,Overall Verdict,Personalization Hook
"Duroshox Pvt. Ltd.","duroshox.com","Pune, Maharashtra","Basket C — Precision Auto Components","Custom-engineered suspension systems, advanced dampers, and precision seating mechanisms for heavy commercial vehicles and off-highway machinery.","Rs.100-300Cr","Anshul Goel (Managing Director, corporate engineering background with global continuous improvement experience).","PASS — Owns specialized, large-scale shock absorber and damper manufacturing plants in Pune.","PASS — Headquarters and primary design/manufacturing units are located in Pune.","Strong (20)","Possesses critical global regulatory/quality certifications including IATF 16949 and ISO 14001, utilizing customized proprietary damping valving designs.","Strong (15)","MD Anshul Goel continuously champions structured operational methodologies and lean manufacturing systems across plants.","Strong (15)","Strong sector tailwinds driven by the Indian infrastructure surge and the national focus on domestic commercial vehicle localization.","Strong (15)","Meets 3 thresholds: active operational expansion projects, current website updates, and consistent growth metrics in public financial reports.","Strong (20)","Confirmed integration of tier-1 corporate ERP infrastructure paired with structured shop-floor metrics and quality management systems.","Strong (15)","Gen-2 leadership is integrated into executive positions, supported by professional business unit heads managing distinct portfolios.","100/100 — Band A","Strong Fit — High-performing manufacturer with robust system compliance, clear succession planning, and advanced precision product engineering.","\"Noticed your deep engineering capabilities in custom damper designs for heavy off-highway equipment out of your Pune facilities.\""
"Finechem Performance Polymers","finechem.in","Pune, Maharashtra","Basket A — Performance Chemicals","Specialty polymer modifiers, high-performance structural additives, and customized engineering resins for technical plastic compounding.","Rs.30-100Cr","Dr. S. K. Kulkarni (Founder & MD, PhD in Polymer Chemistry from NCL).","PASS — Maintains an advanced technical chemical compounding facility in Chakan industrial cluster.","PASS — Operational factory and technical R&D hub are both situated in Pune.","Strong (20)","Features a fully DSIR-recognized in-house R&D lab with multiple distinct proprietary formulations and custom polymer compound options.","Strong (15)","The founder possesses a deep technical PhD background, combining academic rigor with extensive structural plant operations.","Strong (15)","Benefiting directly from local import substitution shifts and the substantial growth of domestic technical plastics processing.","Moderate (8)","Meets 1 threshold: actively updated digital platforms and documented expansion of technical export variants over the past 18 months.","Strong (20)","Uses a completely integrated SAP Business One system to coordinate complex raw chemical batch tracing and real-time inventory management.","Weak (0)","Run as a centralized founder-driven model with no active Gen-2 integration or structured external C-suite management tier.","78/100 — Band B","Fit — Excellent technical differentiation and strong internal systems, though heavily reliant on the founder's direct operational decisions.","\"Impressive focus on custom polymer modifiers at your DSIR-recognized R&D center in Pune, especially regarding engineering plastics.\""
"Pratham Technologies Pvt. Ltd.","prathamtech.com","Pune, Maharashtra","Basket C — Precision Auto Components & Engineering","High-precision paper folding machinery, vision inspection systems, and out-sert leaflet packing automation machines for global pharmaceutical lines.","Rs.30-100Cr","Sanjay Deshpande (Founder & Managing Director, technical engineering background).","PASS — Owns complete engineering, assembly, and testing lines for packaging machinery in Pune.","PASS — HQ and specialized manufacturing infrastructure are fully functional in Pune.","Strong (20)","Pioneered pharmaceutical leaflet folding machines in India with specialized German-grade counting sensors and micro-folding engineering.","Strong (15)","Founder has an intensive engineering background; implemented formal design documentation and systemized standardized assembly workflows.","Strong (15)","Heavily supported by global pharmaceutical tracing regulations and the strict zero-error operational mandates across healthcare packing lines.","Strong (15)","Meets 2 thresholds: Active global exports to 20+ countries and active job profiles listed for multi-axis CNC machine operator positions.","Strong (20)","Utilizes an ERP infrastructure for bill of materials (BOM) management and maintains structured quality calibration dashboards.","Moderate (8)","Gen-2 family members are taking operational design roles, supported by non-family division engineering managers.","93/100 — Band A","Strong Fit — Exceptional niche engineering producer exhibiting a deep machine capability moat and strong operational infrastructure.","\"Saw how Pratham Technologies is streamlining pharmaceutical packaging lines with your 100% vision verification micro-folding machines.\""
"Tranter India Pvt. Ltd.","tranter.com","Pune, Maharashtra","Basket C — Precision Auto Components & Engineering","Custom-welded and plate heat exchangers, specialized thermal processing units, and custom fluid dynamics infrastructure.","Rs.100-300Cr","Arun Kumar (Director of Operations & Plant Head, Pune manufacturing division).","PASS — Runs an intensive, heavy-duty engineering plate fabrication facility in Pune.","PASS — Primary domestic manufacturing plant and regional operations are situated in Pune.","Strong (20)","Maintains custom-engineered tooling configurations and high-tonnage forming presses that generic structural workshops cannot replicate.","Moderate (8)","Managed by specialized technical operations professionals with structured plant KPIs and formal manufacturing safety matrices.","Strong (15)","Riding massive macro tailwinds driven by local green energy initiatives, chemical processing expansion, and heavy industrial capital expenditure.","Strong (15)","Meets 2 thresholds: Confirmed capacity modernization within the last 18 months and consistent talent recruitment for industrial QA engineers.","Strong (20)","Operates via a completely integrated global ERP platform linked to active supply chain optimization databases.","Weak (0)","Functioning purely as an independent professional corporate matrix unit under a regional director, without visible family succession architecture.","78/100 — Band B","Fit — Highly systemized manufacturing infrastructure with advanced engineering moats, though missing the specific Gen-2 generational dynamic.","\"Excellent work on your high-efficiency plate heat exchanger manufacturing and thermal testing processes out of your Pune plant.\""
"Sudarshan Chemical Industries Ltd.","sudarshan.com","Pune, Maharashtra","Basket A — Custom Synthesis & Specialty Chemicals","High-performance organic, inorganic, and specialty effect pigments used globally in automotive coatings, plastics, and printing inks.",">Rs.500Cr","Pradeep Rathi (Chairman) / Rajesh Rathi (Managing Director).","PASS — Operates world-class chemical manufacturing plants and extensive research facilities in Roha and Mahad (Pune cluster).","PASS — Corporate headquarters, central global R&D center, and key management operations are anchored in Pune.","Strong (20)","Holds an extensive portfolio of international chemical process patents, global regulatory approvals, and a state-of-the-art R&D facility.","Strong (15)","Led by a highly systemized corporate board with extensive executive education from leading international universities and deeply structured systems thinking.","Strong (15)","Major beneficiary of the global 'China+1' chemical sourcing shift and robust domestic automotive and premium coatings expansion.","Strong (15)","Meets multiple criteria: consistent capacity additions, strong export market penetration, and robust quarterly revenue growth indicators.","Strong (20)","Deep deployment of multi-module SAP S/4HANA enterprise resource planning integrated across production logistics and costing platforms.","Strong (15)","Smooth generational transition with Gen-2 leaders actively managing global portfolios alongside non-family corporate business unit chiefs.","98/100 — Band A","FAIL — Structurally disqualified due to financial gate boundaries; current revenue exceeds the maximum threshold limit of Rs. 500Cr.","\"N/A - Disqualified (Revenue Boundary Exceeded)\""
"Excel Trading & Distribution","exceltrade.co.in","Pune, Maharashtra","Basket A — Performance Chemicals (Bulk)","Bulk distribution, chemical trading, and commercial inventory importing of generic industrial solvents and intermediate plasticizers.","Rs.100-300Cr","Rajesh Shah (Proprietor & Commercial Director).","FAIL — Purely an intermediary trading house and commercial clearing house; owns no production machinery or R&D units.","PASS — Local central storage warehouse and sales office located in Pune.","Weak (0)","Supplies standard off-the-shelf bulk industrial commodities with zero proprietary intellectual property or custom formulations.","Weak (0)","Management focuses strictly on commercial price trading and bulk arbitrage, showing minimal systems engineering or operational design.","Moderate (8)","The broader chemicals trading market remains stable, although transactional margins face consistent pressure from direct sales.","Weak (0)","Maintains a static, multi-year old informational page with zero active employment listings or structural investments.","Weak (0)","Operates via standalone legacy accounting software with paper-reliant warehouse tracking and no cross-functional ERP systems.","Weak (0)","Structured entirely as a solo proprietor setup where all critical organizational and financial control remains with the owner.","8/100 — Band D","Do Not Include — Disqualified at the initial gate stage due to lack of an in-house manufacturing footprint or technical process differentiation.","\"N/A - Disqualified\""
